{
  "document_id": "Administrative form/00248",
  "engine": "paddleocr",
  "raw_text": "بوتلاو ةبرلل ةبومحلا ةداكألا رمما كرم ةمج ةارابم زايتجا صيخرت بلط يصخشلا مسالا يلئاعلا مسالا ريجاتلا مقر ةبردلا راطإلا فيطوتلا خيرات :ةيلاحلا ةمملا eمل ا لمصعلا رقم ةارابح زايتجا عيقوتو يأر رشابملا يصبنرلا ديمسلا ل يتورنو وار يميكبا ريملا  ديمملل ةيميداكالا ريدم ديمسلا عبقوتو يأر رملا ءم مل هول رارجلا تاعملردب ةللطم",
  "tokens": [
    {
      "text": "بوتلاو",
      "bbox": [
        699.0,
        696.0,
        898.0,
        738.0
      ],
      "confidence": 79.69
    },
    {
      "text": "ةبرلل ةبومحلا",
      "bbox": [
        885.0,
        699.0,
        1138.0,
        751.0
      ],
      "confidence": 84.13
    },
    {
      "text": "ةداكألا",
      "bbox": [
        1116.0,
        704.0,
        1320.0,
        750.0
      ],
      "confidence": 75.45
    },
    {
      "text": "رمما كرم ةمج",
      "bbox": [
        856.0,
        758.0,
        1162.0,
        800.0
      ],
      "confidence": 75.38
    },
    {
      "text": "ةارابم",
      "bbox": [
        659.0,
        910.0,
        854.0,
        1023.0
      ],
      "confidence": 99.98
    },
    {
      "text": "زايتجا",
      "bbox": [
        864.0,
        929.0,
        1042.0,
        1021.0
      ],
      "confidence": 99.93
    },
    {
      "text": "صيخرت",
      "bbox": [
        1055.0,
        946.0,
        1303.0,
        1021.0
      ],
      "confidence": 99.99
    },
    {
      "text": "بلط",
      "bbox": [
        1280.0,
        927.0,
        1433.0,
        1014.0
      ],
      "confidence": 96.64
    },
    {
      "text": "يصخشلا مسالا",
      "bbox": [
        1600.0,
        1120.0,
        1850.0,
        1188.0
      ],
      "confidence": 91.6
    },
    {
      "text": "يلئاعلا مسالا",
      "bbox": [
        1608.0,
        1258.0,
        1850.0,
        1326.0
      ],
      "confidence": 86.17
    },
    {
      "text": "ريجاتلا مقر",
      "bbox": [
        1646.0,
        1404.0,
        1849.0,
        1467.0
      ],
      "confidence": 93.69
    },
    {
      "text": "ةبردلا",
      "bbox": [
        976.0,
        1550.0,
        1121.0,
        1608.0
      ],
      "confidence": 91.96
    },
    {
      "text": "راطإلا",
      "bbox": [
        1721.0,
        1542.0,
        1845.0,
        1600.0
      ],
      "confidence": 99.55
    },
    {
      "text": "فيطوتلا خيرات",
      "bbox": [
        1592.0,
        1679.0,
        1849.0,
        1738.0
      ],
      "confidence": 82.87
    },
    {
      "text": ":ةيلاحلا ةمملا",
      "bbox": [
        1600.0,
        1799.0,
        1850.0,
        1867.0
      ],
      "confidence": 93.78
    },
    {
      "text": "eمل ا",
      "bbox": [
        1162.0,
        1933.0,
        1386.0,
        1992.0
      ],
      "confidence": 65.13
    },
    {
      "text": "لمصعلا رقم",
      "bbox": [
        1667.0,
        1950.0,
        1845.0,
        1996.0
      ],
      "confidence": 72.41
    },
    {
      "text": "ةارابح زايتجا",
      "bbox": [
        1630.0,
        2075.0,
        1857.0,
        2133.0
      ],
      "confidence": 82.56
    },
    {
      "text": "عيقوتو يأر",
      "bbox": [
        1212.0,
        2362.0,
        1365.0,
        2408.0
      ],
      "confidence": 83.97
    },
    {
      "text": "رشابملا",
      "bbox": [
        1404.0,
        2353.0,
        1507.0,
        2410.0
      ],
      "confidence": 97.72
    },
    {
      "text": "يصبنرلا",
      "bbox": [
        1510.0,
        2362.0,
        1613.0,
        2408.0
      ],
      "confidence": 66.29
    },
    {
      "text": "ديمسلا",
      "bbox": [
        1605.0,
        2367.0,
        1675.0,
        2400.0
      ],
      "confidence": 92.78
    },
    {
      "text": "ل يتورنو وار",
      "bbox": [
        1667.0,
        2358.0,
        1828.0,
        2404.0
      ],
      "confidence": 55.45
    },
    {
      "text": "يميكبا ريملا ",
      "bbox": [
        933.0,
        2353.0,
        1147.0,
        2431.0
      ],
      "confidence": 60.49
    },
    {
      "text": "ديمملل",
      "bbox": [
        1133.0,
        2371.0,
        1204.0,
        2404.0
      ],
      "confidence": 83.0
    },
    {
      "text": "ةيميداكالا",
      "bbox": [
        438.0,
        2392.0,
        579.0,
        2438.0
      ],
      "confidence": 89.47
    },
    {
      "text": "ريدم ديمسلا",
      "bbox": [
        590.0,
        2378.0,
        754.0,
        2434.0
      ],
      "confidence": 93.88
    },
    {
      "text": "عبقوتو يأر",
      "bbox": [
        736.0,
        2383.0,
        902.0,
        2429.0
      ],
      "confidence": 88.31
    },
    {
      "text": "رملا ءم مل",
      "bbox": [
        1215.0,
        3032.0,
        1465.0,
        3093.0
      ],
      "confidence": 61.19
    },
    {
      "text": "هول رارجلا تاعملردب ةللطم",
      "bbox": [
        843.0,
        3049.0,
        1234.0,
        3113.0
      ],
      "confidence": 62.9
    }
  ],
  "processing_time_ms": 433
}