{
  "document_id": "Handwritten text/0097",
  "engine": "paddleocr",
  "raw_text": "5CALENDAR NOPQ ٥٦٢٧ ينا نكامألا رعزن بحا رتلا اديحبس الف تنك اماراف لوعآ هلاو ننلاI سثيعأآ بح نف ضاحلا يضاملا يرحمذ ددخ يسفيوتسسور رودوي",
  "tokens": [
    {
      "text": "5CALENDAR",
      "bbox": [
        618.0,
        590.0,
        835.0,
        643.0
      ],
      "confidence": 92.46
    },
    {
      "text": "NOPQ",
      "bbox": [
        622.0,
        694.0,
        762.0,
        742.0
      ],
      "confidence": 78.66
    },
    {
      "text": "٥٦٢٧",
      "bbox": [
        636.0,
        805.0,
        713.0,
        829.0
      ],
      "confidence": 63.78
    },
    {
      "text": "ينا",
      "bbox": [
        1613.0,
        973.0,
        1770.0,
        1099.0
      ],
      "confidence": 84.62
    },
    {
      "text": "نكامألا",
      "bbox": [
        868.0,
        1000.0,
        1173.0,
        1113.0
      ],
      "confidence": 98.08
    },
    {
      "text": "رعزن",
      "bbox": [
        1214.0,
        1015.0,
        1380.0,
        1108.0
      ],
      "confidence": 50.91
    },
    {
      "text": "بحا",
      "bbox": [
        1384.0,
        1015.0,
        1589.0,
        1091.0
      ],
      "confidence": 68.78
    },
    {
      "text": "رتلا",
      "bbox": [
        702.0,
        998.0,
        870.0,
        1146.0
      ],
      "confidence": 70.6
    },
    {
      "text": "اديحبس",
      "bbox": [
        1238.0,
        1174.0,
        1499.0,
        1267.0
      ],
      "confidence": 75.27
    },
    {
      "text": "الف",
      "bbox": [
        1520.0,
        1178.0,
        1634.0,
        1264.0
      ],
      "confidence": 93.61
    },
    {
      "text": "تنك",
      "bbox": [
        1619.0,
        1160.0,
        1789.0,
        1255.0
      ],
      "confidence": 71.69
    },
    {
      "text": "اماراف",
      "bbox": [
        598.0,
        1205.0,
        817.0,
        1295.0
      ],
      "confidence": 86.74
    },
    {
      "text": "لوعآ",
      "bbox": [
        830.0,
        1197.0,
        1031.0,
        1296.0
      ],
      "confidence": 72.85
    },
    {
      "text": "هلاو",
      "bbox": [
        1040.0,
        1173.0,
        1216.0,
        1296.0
      ],
      "confidence": 93.5
    },
    {
      "text": "ننلاI",
      "bbox": [
        1669.0,
        1340.0,
        1794.0,
        1440.0
      ],
      "confidence": 50.08
    },
    {
      "text": "سثيعأآ",
      "bbox": [
        1053.0,
        1356.0,
        1440.0,
        1461.0
      ],
      "confidence": 69.55
    },
    {
      "text": "بح",
      "bbox": [
        1452.0,
        1345.0,
        1650.0,
        1452.0
      ],
      "confidence": 75.07
    },
    {
      "text": "نف ضاحلا",
      "bbox": [
        738.0,
        1368.0,
        1042.0,
        1491.0
      ],
      "confidence": 82.98
    },
    {
      "text": "يضاملا يرحمذ",
      "bbox": [
        1083.0,
        1507.0,
        1567.0,
        1649.0
      ],
      "confidence": 89.26
    },
    {
      "text": "ددخ",
      "bbox": [
        1587.0,
        1517.0,
        1800.0,
        1612.0
      ],
      "confidence": 94.52
    },
    {
      "text": "يسفيوتسسور",
      "bbox": [
        765.0,
        1809.0,
        1200.0,
        1920.0
      ],
      "confidence": 74.0
    },
    {
      "text": "رودوي",
      "bbox": [
        1267.0,
        1804.0,
        1529.0,
        1901.0
      ],
      "confidence": 88.71
    }
  ],
  "processing_time_ms": 391
}