{
  "document_id": "Business card/00408",
  "engine": "paddleocr",
  "raw_text": "ةغبصم سوا انيك ةدو  جو فاظن راخبلا ىللع يوك فاج فيظنت مالتسالاو ميلستلا ةيلزنم ةمدخ ةرهسلاو ءاسنلا سباالم فيظنت يف ةصاخ ةيانع مالتسالا ةمدخ .قبسملا عفدلا جمانرب ايازم ميلستلاو عقبلا ةلازأو فيظنتلا يف نيصصختم تايفشتسملا ةيحصلا دهاعملا ةيدنالل ةصاخ ةمدخ تاكرشلا تادايعلا سرادملا قدانفلا معاطملا ةايح قدنف فلخ ٧٣٢ ينبم ةداج ءابزلا عراش ةعطق يلوح ناديم ٥l٤٧٧o٧ نوفلت",
  "tokens": [
    {
      "text": "ةغبصم",
      "bbox": [
        644.0,
        142.0,
        727.0,
        178.0
      ],
      "confidence": 99.61
    },
    {
      "text": "سوا",
      "bbox": [
        459.0,
        171.0,
        601.0,
        233.0
      ],
      "confidence": 63.5
    },
    {
      "text": "انيك",
      "bbox": [
        602.0,
        167.0,
        733.0,
        236.0
      ],
      "confidence": 77.81
    },
    {
      "text": "ةدو ",
      "bbox": [
        464.0,
        230.0,
        508.0,
        256.0
      ],
      "confidence": 83.07
    },
    {
      "text": "جو",
      "bbox": [
        501.0,
        233.0,
        575.0,
        257.0
      ],
      "confidence": 83.32
    },
    {
      "text": "فاظن",
      "bbox": [
        628.0,
        227.0,
        728.0,
        257.0
      ],
      "confidence": 90.05
    },
    {
      "text": "راخبلا",
      "bbox": [
        635.0,
        286.0,
        702.0,
        313.0
      ],
      "confidence": 98.76
    },
    {
      "text": "ىللع",
      "bbox": [
        703.0,
        284.0,
        746.0,
        315.0
      ],
      "confidence": 83.98
    },
    {
      "text": "يوك",
      "bbox": [
        747.0,
        288.0,
        804.0,
        315.0
      ],
      "confidence": 95.88
    },
    {
      "text": "فاج",
      "bbox": [
        819.0,
        284.0,
        868.0,
        314.0
      ],
      "confidence": 99.67
    },
    {
      "text": "فيظنت",
      "bbox": [
        874.0,
        289.0,
        941.0,
        312.0
      ],
      "confidence": 99.8
    },
    {
      "text": "مالتسالاو",
      "bbox": [
        628.0,
        320.0,
        717.0,
        346.0
      ],
      "confidence": 94.61
    },
    {
      "text": "ميلستلا",
      "bbox": [
        719.0,
        320.0,
        793.0,
        347.0
      ],
      "confidence": 95.26
    },
    {
      "text": "ةيلزنم",
      "bbox": [
        815.0,
        318.0,
        886.0,
        348.0
      ],
      "confidence": 96.98
    },
    {
      "text": "ةمدخ",
      "bbox": [
        883.0,
        322.0,
        940.0,
        345.0
      ],
      "confidence": 94.78
    },
    {
      "text": "ةرهسلاو",
      "bbox": [
        519.0,
        356.0,
        595.0,
        383.0
      ],
      "confidence": 97.67
    },
    {
      "text": "ءاسنلا",
      "bbox": [
        599.0,
        357.0,
        658.0,
        381.0
      ],
      "confidence": 91.67
    },
    {
      "text": "سباالم",
      "bbox": [
        663.0,
        359.0,
        730.0,
        382.0
      ],
      "confidence": 87.43
    },
    {
      "text": "فيظنت يف",
      "bbox": [
        731.0,
        357.0,
        826.0,
        384.0
      ],
      "confidence": 86.48
    },
    {
      "text": "ةصاخ",
      "bbox": [
        826.0,
        359.0,
        884.0,
        382.0
      ],
      "confidence": 99.69
    },
    {
      "text": "ةيانع",
      "bbox": [
        890.0,
        360.0,
        942.0,
        385.0
      ],
      "confidence": 95.09
    },
    {
      "text": "مالتسالا",
      "bbox": [
        167.0,
        378.0,
        263.0,
        422.0
      ],
      "confidence": 96.25
    },
    {
      "text": "ةمدخ",
      "bbox": [
        268.0,
        385.0,
        332.0,
        416.0
      ],
      "confidence": 93.81
    },
    {
      "text": ".قبسملا",
      "bbox": [
        700.0,
        396.0,
        763.0,
        424.0
      ],
      "confidence": 91.57
    },
    {
      "text": "عفدلا",
      "bbox": [
        767.0,
        396.0,
        823.0,
        425.0
      ],
      "confidence": 81.52
    },
    {
      "text": "جمانرب",
      "bbox": [
        823.0,
        396.0,
        893.0,
        427.0
      ],
      "confidence": 99.9
    },
    {
      "text": "ايازم",
      "bbox": [
        895.0,
        397.0,
        944.0,
        425.0
      ],
      "confidence": 99.37
    },
    {
      "text": "ميلستلاو",
      "bbox": [
        197.0,
        423.0,
        303.0,
        466.0
      ],
      "confidence": 93.02
    },
    {
      "text": "عقبلا",
      "bbox": [
        598.0,
        426.0,
        656.0,
        460.0
      ],
      "confidence": 99.08
    },
    {
      "text": "ةلازأو",
      "bbox": [
        654.0,
        430.0,
        709.0,
        455.0
      ],
      "confidence": 99.38
    },
    {
      "text": "فيظنتلا",
      "bbox": [
        713.0,
        430.0,
        795.0,
        457.0
      ],
      "confidence": 95.05
    },
    {
      "text": "يف",
      "bbox": [
        796.0,
        429.0,
        833.0,
        462.0
      ],
      "confidence": 95.06
    },
    {
      "text": "نيصصختم",
      "bbox": [
        834.0,
        434.0,
        943.0,
        457.0
      ],
      "confidence": 97.07
    },
    {
      "text": "تايفشتسملا",
      "bbox": [
        450.0,
        469.0,
        554.0,
        492.0
      ],
      "confidence": 97.56
    },
    {
      "text": "ةيحصلا",
      "bbox": [
        585.0,
        468.0,
        663.0,
        495.0
      ],
      "confidence": 93.72
    },
    {
      "text": "دهاعملا",
      "bbox": [
        669.0,
        470.0,
        731.0,
        493.0
      ],
      "confidence": 98.54
    },
    {
      "text": "ةيدنالل",
      "bbox": [
        748.0,
        471.0,
        820.0,
        495.0
      ],
      "confidence": 90.31
    },
    {
      "text": "ةصاخ",
      "bbox": [
        822.0,
        470.0,
        882.0,
        493.0
      ],
      "confidence": 96.3
    },
    {
      "text": "ةمدخ",
      "bbox": [
        884.0,
        472.0,
        941.0,
        496.0
      ],
      "confidence": 97.47
    },
    {
      "text": "تاكرشلا",
      "bbox": [
        480.0,
        500.0,
        573.0,
        523.0
      ],
      "confidence": 96.57
    },
    {
      "text": "تادايعلا",
      "bbox": [
        596.0,
        498.0,
        677.0,
        525.0
      ],
      "confidence": 86.21
    },
    {
      "text": "سرادملا",
      "bbox": [
        691.0,
        498.0,
        765.0,
        528.0
      ],
      "confidence": 97.47
    },
    {
      "text": "قدانفلا",
      "bbox": [
        782.0,
        499.0,
        856.0,
        526.0
      ],
      "confidence": 96.52
    },
    {
      "text": "معاطملا",
      "bbox": [
        872.0,
        500.0,
        943.0,
        530.0
      ],
      "confidence": 93.47
    },
    {
      "text": "ةايح",
      "bbox": [
        122.0,
        555.0,
        179.0,
        592.0
      ],
      "confidence": 99.75
    },
    {
      "text": "قدنف",
      "bbox": [
        179.0,
        558.0,
        241.0,
        589.0
      ],
      "confidence": 97.48
    },
    {
      "text": "فلخ",
      "bbox": [
        242.0,
        561.0,
        302.0,
        584.0
      ],
      "confidence": 84.76
    },
    {
      "text": "٧٣٢",
      "bbox": [
        321.0,
        561.0,
        375.0,
        585.0
      ],
      "confidence": 91.81
    },
    {
      "text": "ينبم",
      "bbox": [
        384.0,
        562.0,
        442.0,
        595.0
      ],
      "confidence": 99.73
    },
    {
      "text": "ةداج",
      "bbox": [
        473.0,
        560.0,
        530.0,
        592.0
      ],
      "confidence": 99.95
    },
    {
      "text": "ءابزلا",
      "bbox": [
        556.0,
        564.0,
        617.0,
        592.0
      ],
      "confidence": 98.71
    },
    {
      "text": "عراش",
      "bbox": [
        617.0,
        561.0,
        674.0,
        597.0
      ],
      "confidence": 88.05
    },
    {
      "text": "ةعطق",
      "bbox": [
        722.0,
        565.0,
        784.0,
        589.0
      ],
      "confidence": 96.88
    },
    {
      "text": "يلوح",
      "bbox": [
        803.0,
        566.0,
        865.0,
        599.0
      ],
      "confidence": 97.65
    },
    {
      "text": "ناديم",
      "bbox": [
        866.0,
        566.0,
        933.0,
        598.0
      ],
      "confidence": 98.73
    },
    {
      "text": "٥l٤٧٧o٧",
      "bbox": [
        418.0,
        596.0,
        570.0,
        634.0
      ],
      "confidence": 74.56
    },
    {
      "text": "نوفلت",
      "bbox": [
        593.0,
        606.0,
        649.0,
        639.0
      ],
      "confidence": 92.21
    }
  ],
  "processing_time_ms": 435
}