{
  "document_id": "Map/00597",
  "engine": "paddleocr",
  "raw_text": "طُطخُم ةَنيدَملا لخاد لاقتنالأ لامشلا ةعماجلا ةسيرملا فييف نيع ينوش محا عراش ينانبللا نال ربا اسنرف ةرافس ةنيدلا   خر يزكرلا كنبلا ريكلا  يارسلا ةرارو رضح لا بيلصل ةيلخادلا  طيرق عئانصلا",
  "tokens": [
    {
      "text": "  ",
      "bbox": [
        0.0,
        86.0,
        213.0,
        269.0
      ],
      "confidence": 66.13
    },
    {
      "text": "طُطخُم",
      "bbox": [
        1028.0,
        174.0,
        1184.0,
        252.0
      ],
      "confidence": 85.97
    },
    {
      "text": "ةَنيدَملا",
      "bbox": [
        812.0,
        177.0,
        1024.0,
        260.0
      ],
      "confidence": 84.9
    },
    {
      "text": "لخاد",
      "bbox": [
        1187.0,
        178.0,
        1332.0,
        259.0
      ],
      "confidence": 81.52
    },
    {
      "text": "لاقتنالأ",
      "bbox": [
        1327.0,
        155.0,
        1535.0,
        255.0
      ],
      "confidence": 88.69
    },
    {
      "text": "لامشلا",
      "bbox": [
        290.0,
        368.0,
        383.0,
        410.0
      ],
      "confidence": 98.76
    },
    {
      "text": "ةعماجلا",
      "bbox": [
        1069.0,
        586.0,
        1166.0,
        621.0
      ],
      "confidence": 99.59
    },
    {
      "text": "ةسيرملا",
      "bbox": [
        1214.0,
        616.0,
        1327.0,
        669.0
      ],
      "confidence": 93.79
    },
    {
      "text": "فييف",
      "bbox": [
        1418.0,
        614.0,
        1452.0,
        632.0
      ],
      "confidence": 57.96
    },
    {
      "text": "نيع",
      "bbox": [
        1336.0,
        628.0,
        1393.0,
        662.0
      ],
      "confidence": 98.81
    },
    {
      "text": "ينوش محا عراش",
      "bbox": [
        1768.0,
        632.0,
        1880.0,
        670.0
      ],
      "confidence": 83.85
    },
    {
      "text": "ينانبللا",
      "bbox": [
        1899.0,
        660.0,
        2048.0,
        751.0
      ],
      "confidence": 96.6
    },
    {
      "text": "نال ربا",
      "bbox": [
        2039.0,
        676.0,
        2130.0,
        747.0
      ],
      "confidence": 71.57
    },
    {
      "text": "اسنرف ةرافس",
      "bbox": [
        1243.0,
        709.0,
        1341.0,
        734.0
      ],
      "confidence": 87.96
    },
    {
      "text": "ةنيدلا ",
      "bbox": [
        2047.0,
        778.0,
        2124.0,
        811.0
      ],
      "confidence": 82.76
    },
    {
      "text": " خر",
      "bbox": [
        2079.0,
        855.0,
        2117.0,
        873.0
      ],
      "confidence": 68.12
    },
    {
      "text": "يزكرلا",
      "bbox": [
        1279.0,
        873.0,
        1350.0,
        906.0
      ],
      "confidence": 97.29
    },
    {
      "text": "كنبلا",
      "bbox": [
        1352.0,
        873.0,
        1402.0,
        901.0
      ],
      "confidence": 99.22
    },
    {
      "text": "ريكلا ",
      "bbox": [
        1787.0,
        873.0,
        1855.0,
        906.0
      ],
      "confidence": 89.11
    },
    {
      "text": "يارسلا",
      "bbox": [
        1841.0,
        873.0,
        1911.0,
        906.0
      ],
      "confidence": 99.89
    },
    {
      "text": "ةرارو",
      "bbox": [
        1738.0,
        911.0,
        1784.0,
        944.0
      ],
      "confidence": 97.41
    },
    {
      "text": "رضح لا بيلصل",
      "bbox": [
        1521.0,
        926.0,
        1622.0,
        957.0
      ],
      "confidence": 84.32
    },
    {
      "text": "ةيلخادلا",
      "bbox": [
        1720.0,
        937.0,
        1781.0,
        969.0
      ],
      "confidence": 97.72
    },
    {
      "text": " طيرق",
      "bbox": [
        768.0,
        989.0,
        851.0,
        1035.0
      ],
      "confidence": 90.21
    },
    {
      "text": "عئانصلا",
      "bbox": [
        1473.0,
        1152.0,
        1561.0,
        1196.0
      ],
      "confidence": 92.94
    }
  ],
  "processing_time_ms": 330
}