{
  "document_id": "Comics/00155",
  "engine": "paddleocr",
  "raw_text": "ةبانع انبلاد ةفيلألا تانئاويحلاو رصان لمأ فيلاب يركسعلا مير موش نانبلا راد",
  "tokens": [
    {
      "text": "ةبانع",
      "bbox": [
        294.0,
        103.0,
        642.0,
        240.0
      ],
      "confidence": 98.91
    },
    {
      "text": "انبلاد",
      "bbox": [
        7.0,
        234.0,
        35.0,
        250.0
      ],
      "confidence": 90.93
    },
    {
      "text": "ةفيلألا",
      "bbox": [
        244.0,
        249.0,
        360.0,
        314.0
      ],
      "confidence": 89.94
    },
    {
      "text": "تانئاويحلاو",
      "bbox": [
        364.0,
        254.0,
        549.0,
        300.0
      ],
      "confidence": 89.03
    },
    {
      "text": "رصان لمأ",
      "bbox": [
        366.0,
        454.0,
        459.0,
        484.0
      ],
      "confidence": 97.89
    },
    {
      "text": "فيلاب",
      "bbox": [
        465.0,
        458.0,
        503.0,
        475.0
      ],
      "confidence": 79.0
    },
    {
      "text": "يركسعلا مير",
      "bbox": [
        369.0,
        483.0,
        462.0,
        511.0
      ],
      "confidence": 92.21
    },
    {
      "text": "موش",
      "bbox": [
        465.0,
        491.0,
        504.0,
        506.0
      ],
      "confidence": 77.5
    },
    {
      "text": "نانبلا راد",
      "bbox": [
        224.0,
        604.0,
        284.0,
        633.0
      ],
      "confidence": 95.57
    }
  ],
  "processing_time_ms": 126
}