{
  "document_id": "Business card/00415",
  "engine": "paddleocr",
  "raw_text": "ةلفرسل تارامخلا ليو تارامخلا عاونأ عيمجو ىيزيلملا حرطلاو ةرادإ ش٨ نييكحكلا ةيروغلا ٩٧٦٦٢٧١١ ٦٥١٧٣٤١١ ٤٨٧٨١١١",
  "tokens": [
    {
      "text": "ةلفرسل",
      "bbox": [
        1091.0,
        225.0,
        1406.0,
        410.0
      ],
      "confidence": 99.68
    },
    {
      "text": "تارامخلا",
      "bbox": [
        767.0,
        248.0,
        1117.0,
        394.0
      ],
      "confidence": 97.23
    },
    {
      "text": "ليو",
      "bbox": [
        1402.0,
        256.0,
        1582.0,
        395.0
      ],
      "confidence": 60.87
    },
    {
      "text": "تارامخلا",
      "bbox": [
        948.0,
        412.0,
        1154.0,
        488.0
      ],
      "confidence": 93.11
    },
    {
      "text": "عاونأ",
      "bbox": [
        1141.0,
        407.0,
        1265.0,
        495.0
      ],
      "confidence": 97.2
    },
    {
      "text": "عيمجو ىيزيلملا",
      "bbox": [
        1261.0,
        400.0,
        1572.0,
        497.0
      ],
      "confidence": 93.7
    },
    {
      "text": "حرطلاو",
      "bbox": [
        785.0,
        416.0,
        952.0,
        495.0
      ],
      "confidence": 94.82
    },
    {
      "text": "ةرادإ",
      "bbox": [
        987.0,
        559.0,
        1143.0,
        643.0
      ],
      "confidence": 99.99
    },
    {
      "text": "ش٨",
      "bbox": [
        1311.0,
        815.0,
        1442.0,
        921.0
      ],
      "confidence": 99.92
    },
    {
      "text": "نييكحكلا",
      "bbox": [
        843.0,
        821.0,
        1319.0,
        938.0
      ],
      "confidence": 93.06
    },
    {
      "text": "ةيروغلا",
      "bbox": [
        397.0,
        842.0,
        800.0,
        939.0
      ],
      "confidence": 98.15
    },
    {
      "text": "٩٧٦٦٢٧١١",
      "bbox": [
        677.0,
        927.0,
        1103.0,
        999.0
      ],
      "confidence": 95.41
    },
    {
      "text": "٦٥١٧٣٤١١",
      "bbox": [
        1139.0,
        921.0,
        1549.0,
        983.0
      ],
      "confidence": 96.17
    },
    {
      "text": "٤٨٧٨١١١",
      "bbox": [
        315.0,
        945.0,
        653.0,
        1005.0
      ],
      "confidence": 98.37
    }
  ],
  "processing_time_ms": 160
}