{
  "document_id": "Official document/00388",
  "engine": "paddleocr",
  "raw_text": "ةيروسلا ةيرلا ةيرومحلا  ةيبرتلا ةرازو  ةقراب ةيبيرلا ةيربم ا : قرلا /١٢٢ ٥١ خيراتلا  عضو نايب بلاطل يب ٤٩٩١ /يف ةدولوم ٥١ خرات رلبا قربانيدل لجسلا كبلط ىلإ ةراشإ ٧/١٢ ةداهش تالجس لا عرجرلا ىد ظل عرذل ةماتلا ةيوناتلا نيبن انيدلل  للجسم كنأ /باتتكا مقرب ٢١٢ ماع ةرود ناحتمالل ةرح ةسارد ةفصب ةجيتنلا تناكو حاجنلا :يف ةقرلا ٢٤/ةجحلا يذ٦/ ل : قفا وملا ٥١ م/ ٧/١٢٢ تاداهشلا ةبعش سيئر تاناحتمالا ةئاد سيئر ةقرلاب ةيبرتلا ريدم",
  "tokens": [
    {
      "text": "ةيروسلا ةيرلا ةيرومحلا ",
      "bbox": [
        1815.0,
        550.0,
        2305.0,
        641.0
      ],
      "confidence": 92.76
    },
    {
      "text": "ةيبرتلا ةرازو",
      "bbox": [
        1973.0,
        627.0,
        2222.0,
        702.0
      ],
      "confidence": 97.01
    },
    {
      "text": " ةقراب ةيبيرلا ةيربم",
      "bbox": [
        1907.0,
        678.0,
        2306.0,
        780.0
      ],
      "confidence": 86.76
    },
    {
      "text": "ا : قرلا",
      "bbox": [
        2150.0,
        765.0,
        2322.0,
        843.0
      ],
      "confidence": 67.72
    },
    {
      "text": "/١٢٢",
      "bbox": [
        1718.0,
        820.0,
        1905.0,
        891.0
      ],
      "confidence": 82.37
    },
    {
      "text": "٥١",
      "bbox": [
        2063.0,
        843.0,
        2146.0,
        899.0
      ],
      "confidence": 86.12
    },
    {
      "text": "خيراتلا ",
      "bbox": [
        2193.0,
        833.0,
        2337.0,
        913.0
      ],
      "confidence": 86.47
    },
    {
      "text": "عضو",
      "bbox": [
        1157.0,
        937.0,
        1346.0,
        1041.0
      ],
      "confidence": 94.74
    },
    {
      "text": "نايب",
      "bbox": [
        1319.0,
        933.0,
        1522.0,
        1049.0
      ],
      "confidence": 99.93
    },
    {
      "text": "بلاطل يب",
      "bbox": [
        2021.0,
        1194.0,
        2236.0,
        1287.0
      ],
      "confidence": 64.44
    },
    {
      "text": "٤٩٩١",
      "bbox": [
        1073.0,
        1204.0,
        1240.0,
        1281.0
      ],
      "confidence": 95.68
    },
    {
      "text": "/يف ةدولوم",
      "bbox": [
        1354.0,
        1213.0,
        1614.0,
        1290.0
      ],
      "confidence": 85.91
    },
    {
      "text": "٥١ خرات",
      "bbox": [
        1067.0,
        1405.0,
        1268.0,
        1498.0
      ],
      "confidence": 85.24
    },
    {
      "text": "رلبا قربانيدل لجسلا",
      "bbox": [
        1473.0,
        1397.0,
        1953.0,
        1479.0
      ],
      "confidence": 77.91
    },
    {
      "text": "كبلط",
      "bbox": [
        1957.0,
        1402.0,
        2067.0,
        1466.0
      ],
      "confidence": 95.4
    },
    {
      "text": "ىلإ ةراشإ",
      "bbox": [
        2057.0,
        1388.0,
        2249.0,
        1472.0
      ],
      "confidence": 88.56
    },
    {
      "text": "٧/١٢",
      "bbox": [
        910.0,
        1410.0,
        1073.0,
        1475.0
      ],
      "confidence": 87.03
    },
    {
      "text": "ةداهش",
      "bbox": [
        1671.0,
        1600.0,
        1807.0,
        1668.0
      ],
      "confidence": 93.6
    },
    {
      "text": "تالجس",
      "bbox": [
        1794.0,
        1600.0,
        1966.0,
        1664.0
      ],
      "confidence": 99.94
    },
    {
      "text": "لا عرجرلا ىد",
      "bbox": [
        1946.0,
        1572.0,
        2289.0,
        1674.0
      ],
      "confidence": 80.69
    },
    {
      "text": "ظل عرذل ةماتلا ةيوناتلا",
      "bbox": [
        1041.0,
        1581.0,
        1655.0,
        1700.0
      ],
      "confidence": 71.86
    },
    {
      "text": "نيبن",
      "bbox": [
        2216.0,
        1742.0,
        2309.0,
        1815.0
      ],
      "confidence": 71.17
    },
    {
      "text": "انيدلل",
      "bbox": [
        1913.0,
        1754.0,
        2019.0,
        1819.0
      ],
      "confidence": 80.34
    },
    {
      "text": " للجسم كنأ",
      "bbox": [
        1981.0,
        1731.0,
        2227.0,
        1825.0
      ],
      "confidence": 86.64
    },
    {
      "text": "/باتتكا",
      "bbox": [
        1106.0,
        1761.0,
        1269.0,
        1855.0
      ],
      "confidence": 87.65
    },
    {
      "text": "مقرب ٢١٢ ماع",
      "bbox": [
        1266.0,
        1762.0,
        1597.0,
        1850.0
      ],
      "confidence": 85.67
    },
    {
      "text": "ةرود",
      "bbox": [
        1596.0,
        1772.0,
        1720.0,
        1836.0
      ],
      "confidence": 99.89
    },
    {
      "text": "ناحتمالل",
      "bbox": [
        1699.0,
        1748.0,
        1880.0,
        1837.0
      ],
      "confidence": 98.64
    },
    {
      "text": "ةرح ةسارد ةفصب",
      "bbox": [
        510.0,
        1780.0,
        933.0,
        1862.0
      ],
      "confidence": 97.51
    },
    {
      "text": "ةجيتنلا",
      "bbox": [
        2159.0,
        1819.0,
        2322.0,
        1901.0
      ],
      "confidence": 94.5
    },
    {
      "text": "تناكو",
      "bbox": [
        2326.0,
        1810.0,
        2472.0,
        1892.0
      ],
      "confidence": 98.38
    },
    {
      "text": "حاجنلا",
      "bbox": [
        1991.0,
        1810.0,
        2168.0,
        1929.0
      ],
      "confidence": 99.94
    },
    {
      "text": ":يف ةقرلا",
      "bbox": [
        2148.0,
        1972.0,
        2364.0,
        2079.0
      ],
      "confidence": 93.23
    },
    {
      "text": "٢٤/ةجحلا",
      "bbox": [
        1680.0,
        2008.0,
        1983.0,
        2081.0
      ],
      "confidence": 73.55
    },
    {
      "text": "يذ٦/",
      "bbox": [
        1979.0,
        2004.0,
        2107.0,
        2073.0
      ],
      "confidence": 81.39
    },
    {
      "text": "ل : قفا وملا",
      "bbox": [
        2109.0,
        2058.0,
        2372.0,
        2156.0
      ],
      "confidence": 76.34
    },
    {
      "text": "٥١",
      "bbox": [
        2027.0,
        2086.0,
        2102.0,
        2137.0
      ],
      "confidence": 82.52
    },
    {
      "text": "م/ ٧/١٢٢",
      "bbox": [
        1740.0,
        2075.0,
        2007.0,
        2169.0
      ],
      "confidence": 86.68
    },
    {
      "text": "تاداهشلا ةبعش سيئر",
      "bbox": [
        2088.0,
        2205.0,
        2521.0,
        2310.0
      ],
      "confidence": 95.78
    },
    {
      "text": "تاناحتمالا ةئاد سيئر",
      "bbox": [
        1393.0,
        2248.0,
        1857.0,
        2336.0
      ],
      "confidence": 94.28
    },
    {
      "text": "ةقرلاب ةيبرتلا",
      "bbox": [
        554.0,
        2300.0,
        866.0,
        2391.0
      ],
      "confidence": 92.24
    },
    {
      "text": "ريدم",
      "bbox": [
        880.0,
        2309.0,
        976.0,
        2378.0
      ],
      "confidence": 94.21
    }
  ],
  "processing_time_ms": 486
}