{
  "document_id": "Handwritten text/00581",
  "engine": "paddleocr",
  "raw_text": "هرو لثم ضرالاو تاوسل رون هبلا ةحاطر ف ح ابصملا خاصماهي ةتاكشمك هرح دتوبي ُرد ُبكوك اتل ةجاحرلا هيرعالو ةيفرشال ةيوتز تكراس ىص اريراكي راثس هروتل هتلا دهد رويلع رون ةلاو نل لاشألا هتلا درضو كك شش تاعوبطملا ةكرش",
  "tokens": [
    {
      "text": "هرو لثم",
      "bbox": [
        33.0,
        215.0,
        135.0,
        257.0
      ],
      "confidence": 76.55
    },
    {
      "text": "ضرالاو",
      "bbox": [
        151.0,
        208.0,
        267.0,
        256.0
      ],
      "confidence": 88.72
    },
    {
      "text": "تاوسل",
      "bbox": [
        262.0,
        208.0,
        368.0,
        263.0
      ],
      "confidence": 91.73
    },
    {
      "text": "رون هبلا",
      "bbox": [
        389.0,
        222.0,
        506.0,
        269.0
      ],
      "confidence": 83.44
    },
    {
      "text": "ةحاطر",
      "bbox": [
        36.0,
        288.0,
        111.0,
        315.0
      ],
      "confidence": 84.56
    },
    {
      "text": "ف ح",
      "bbox": [
        120.0,
        286.0,
        179.0,
        319.0
      ],
      "confidence": 73.18
    },
    {
      "text": "ابصملا",
      "bbox": [
        165.0,
        291.0,
        241.0,
        320.0
      ],
      "confidence": 76.09
    },
    {
      "text": "خاصماهي",
      "bbox": [
        254.0,
        283.0,
        393.0,
        329.0
      ],
      "confidence": 84.11
    },
    {
      "text": "ةتاكشمك",
      "bbox": [
        409.0,
        285.0,
        510.0,
        326.0
      ],
      "confidence": 66.44
    },
    {
      "text": "هرح دتوبي",
      "bbox": [
        34.0,
        338.0,
        204.0,
        390.0
      ],
      "confidence": 76.35
    },
    {
      "text": "ُرد",
      "bbox": [
        199.0,
        345.0,
        262.0,
        386.0
      ],
      "confidence": 76.1
    },
    {
      "text": "ُبكوك اتل ةجاحرلا",
      "bbox": [
        271.0,
        340.0,
        513.0,
        399.0
      ],
      "confidence": 59.16
    },
    {
      "text": "هيرعالو",
      "bbox": [
        49.0,
        410.0,
        151.0,
        439.0
      ],
      "confidence": 76.53
    },
    {
      "text": "ةيفرشال",
      "bbox": [
        167.0,
        414.0,
        304.0,
        445.0
      ],
      "confidence": 64.48
    },
    {
      "text": "ةيوتز تكراس",
      "bbox": [
        309.0,
        396.0,
        510.0,
        455.0
      ],
      "confidence": 66.54
    },
    {
      "text": "ىص",
      "bbox": [
        306.0,
        474.0,
        376.0,
        505.0
      ],
      "confidence": 64.45
    },
    {
      "text": "اريراكي",
      "bbox": [
        383.0,
        471.0,
        501.0,
        508.0
      ],
      "confidence": 55.87
    },
    {
      "text": "راثس هروتل",
      "bbox": [
        52.0,
        525.0,
        240.0,
        563.0
      ],
      "confidence": 68.59
    },
    {
      "text": "هتلا",
      "bbox": [
        222.0,
        524.0,
        292.0,
        561.0
      ],
      "confidence": 87.99
    },
    {
      "text": "دهد",
      "bbox": [
        296.0,
        533.0,
        370.0,
        573.0
      ],
      "confidence": 73.3
    },
    {
      "text": "رويلع",
      "bbox": [
        369.0,
        525.0,
        457.0,
        570.0
      ],
      "confidence": 82.16
    },
    {
      "text": "رون",
      "bbox": [
        465.0,
        531.0,
        504.0,
        561.0
      ],
      "confidence": 76.73
    },
    {
      "text": "ةلاو نل",
      "bbox": [
        39.0,
        575.0,
        242.0,
        632.0
      ],
      "confidence": 60.13
    },
    {
      "text": "لاشألا هتلا",
      "bbox": [
        252.0,
        584.0,
        414.0,
        624.0
      ],
      "confidence": 85.76
    },
    {
      "text": "درضو",
      "bbox": [
        416.0,
        591.0,
        503.0,
        620.0
      ],
      "confidence": 70.79
    },
    {
      "text": "كك",
      "bbox": [
        466.0,
        629.0,
        507.0,
        673.0
      ],
      "confidence": 74.93
    },
    {
      "text": "شش",
      "bbox": [
        384.0,
        636.0,
        468.0,
        684.0
      ],
      "confidence": 81.22
    },
    {
      "text": "تاعوبطملا ةكرش",
      "bbox": [
        0.0,
        893.0,
        91.0,
        935.0
      ],
      "confidence": 93.48
    }
  ],
  "processing_time_ms": 281
}