{
  "document_id": "Handwritten text/00209",
  "engine": "paddleocr",
  "raw_text": "ةئاقلت ةمابك دصصر رص لاميدح ر  ور سكارع المءر راوكا ةنل",
  "tokens": [
    {
      "text": "ةئاقلت",
      "bbox": [
        1427.0,
        242.0,
        1566.0,
        295.0
      ],
      "confidence": 92.22
    },
    {
      "text": "ةمابك",
      "bbox": [
        1573.0,
        245.0,
        1675.0,
        298.0
      ],
      "confidence": 72.64
    },
    {
      "text": "دصصر",
      "bbox": [
        1416.0,
        582.0,
        1507.0,
        612.0
      ],
      "confidence": 54.95
    },
    {
      "text": "رص",
      "bbox": [
        1542.0,
        714.0,
        1586.0,
        735.0
      ],
      "confidence": 65.33
    },
    {
      "text": "لاميدح",
      "bbox": [
        903.0,
        801.0,
        1126.0,
        843.0
      ],
      "confidence": 71.85
    },
    {
      "text": "ر",
      "bbox": [
        1460.0,
        843.0,
        1504.0,
        867.0
      ],
      "confidence": 98.14
    },
    {
      "text": " ور",
      "bbox": [
        1592.0,
        843.0,
        1644.0,
        867.0
      ],
      "confidence": 59.12
    },
    {
      "text": "سكارع",
      "bbox": [
        1495.0,
        957.0,
        1665.0,
        1008.0
      ],
      "confidence": 64.21
    },
    {
      "text": "المءر",
      "bbox": [
        1347.0,
        959.0,
        1493.0,
        1015.0
      ],
      "confidence": 73.42
    },
    {
      "text": "راوكا",
      "bbox": [
        1442.0,
        1080.0,
        1548.0,
        1125.0
      ],
      "confidence": 92.27
    },
    {
      "text": "ةنل",
      "bbox": [
        1576.0,
        1079.0,
        1678.0,
        1135.0
      ],
      "confidence": 68.66
    }
  ],
  "processing_time_ms": 310
}