{
  "document_id": "Handwritten text/00539",
  "engine": "paddleocr",
  "raw_text": "ج او كاع ١١١,١٢ ٧  يوجخيك ك ",
  "tokens": [
    {
      "text": "ج",
      "bbox": [
        916.0,
        22.0,
        1035.0,
        112.0
      ],
      "confidence": 56.47
    },
    {
      "text": "او",
      "bbox": [
        730.0,
        51.0,
        888.0,
        142.0
      ],
      "confidence": 80.11
    },
    {
      "text": "كاع",
      "bbox": [
        486.0,
        63.0,
        778.0,
        219.0
      ],
      "confidence": 59.04
    },
    {
      "text": "١١١,١٢",
      "bbox": [
        1262.0,
        160.0,
        1510.0,
        276.0
      ],
      "confidence": 62.33
    },
    {
      "text": "٧ ",
      "bbox": [
        1033.0,
        517.0,
        1161.0,
        609.0
      ],
      "confidence": 55.73
    },
    {
      "text": "يوجخيك",
      "bbox": [
        615.0,
        472.0,
        1064.0,
        739.0
      ],
      "confidence": 74.6
    },
    {
      "text": "ك ",
      "bbox": [
        532.0,
        638.0,
        1241.0,
        1019.0
      ],
      "confidence": 54.98
    }
  ],
  "processing_time_ms": 311
}