{
  "document_id": "Comics/00429",
  "engine": "paddleocr",
  "raw_text": "تاوََنلا ىتفدايز رَجَّتَملا يفف هَّمََِب ُبرْضَي ُهلَهَ هل ُيَرَتَشَّيل موسُر ُّطيِرَش ةَكَرََُم",
  "tokens": [
    {
      "text": "تاوََنلا",
      "bbox": [
        424.0,
        219.0,
        513.0,
        253.0
      ],
      "confidence": 78.45
    },
    {
      "text": "ىتفدايز",
      "bbox": [
        520.0,
        215.0,
        602.0,
        253.0
      ],
      "confidence": 74.55
    },
    {
      "text": "رَجَّتَملا",
      "bbox": [
        457.0,
        262.0,
        536.0,
        307.0
      ],
      "confidence": 81.0
    },
    {
      "text": "يفف",
      "bbox": [
        540.0,
        266.0,
        582.0,
        304.0
      ],
      "confidence": 98.34
    },
    {
      "text": "هَّمََِب",
      "bbox": [
        453.0,
        313.0,
        525.0,
        353.0
      ],
      "confidence": 62.93
    },
    {
      "text": "ُبرْضَي",
      "bbox": [
        523.0,
        309.0,
        599.0,
        353.0
      ],
      "confidence": 67.46
    },
    {
      "text": "ُهلَهَ هل ُيَرَتَشَّيل",
      "bbox": [
        454.0,
        356.0,
        610.0,
        406.0
      ],
      "confidence": 53.34
    },
    {
      "text": "موسُر ُّطيِرَش",
      "bbox": [
        470.0,
        404.0,
        606.0,
        469.0
      ],
      "confidence": 75.19
    },
    {
      "text": "ةَكَرََُم",
      "bbox": [
        500.0,
        464.0,
        597.0,
        511.0
      ],
      "confidence": 67.97
    }
  ],
  "processing_time_ms": 102
}