{
  "document_id": "Business card/00468",
  "engine": "paddleocr",
  "raw_text": "x٧ KIA MOTORS هدالواو ةكرش ماعلا قيرطلا ليانعت Tel:",
  "tokens": [
    {
      "text": "x٧",
      "bbox": [
        2002.0,
        1654.0,
        2400.0,
        1831.0
      ],
      "confidence": 57.08
    },
    {
      "text": "KIA",
      "bbox": [
        1915.0,
        1919.0,
        2074.0,
        2003.0
      ],
      "confidence": 91.58
    },
    {
      "text": "MOTORS",
      "bbox": [
        2093.0,
        1919.0,
        2472.0,
        2003.0
      ],
      "confidence": 96.12
    },
    {
      "text": "هدالواو",
      "bbox": [
        1611.0,
        2041.0,
        1936.0,
        2176.0
      ],
      "confidence": 90.43
    },
    {
      "text": "ةكرش",
      "bbox": [
        2451.0,
        2055.0,
        2771.0,
        2181.0
      ],
      "confidence": 95.82
    },
    {
      "text": "ماعلا",
      "bbox": [
        1714.0,
        2278.0,
        1920.0,
        2371.0
      ],
      "confidence": 99.94
    },
    {
      "text": "قيرطلا",
      "bbox": [
        1928.0,
        2262.0,
        2286.0,
        2378.0
      ],
      "confidence": 99.91
    },
    {
      "text": "ليانعت",
      "bbox": [
        2371.0,
        2278.0,
        2678.0,
        2361.0
      ],
      "confidence": 96.98
    },
    {
      "text": "Tel:",
      "bbox": [
        1790.0,
        2405.0,
        2035.0,
        2494.0
      ],
      "confidence": 87.09
    }
  ],
  "processing_time_ms": 404
}