{
  "document_id": "Newspaper/00492",
  "engine": "paddleocr",
  "raw_text": "ردل 4 ةملا ةحعص  قيقحت رابخألا ميلضا تاباحلا بورخلا ام هز ةعامجلا طالبنجو تمسح راوللا و كبرم نولئافتم ةيباختنا ةيوست ةحيضفب دّدهي ريفشو روجألا عيقرتل رمسألا ةرادإل ليئارسإلل كولبلا لوقحلا رطقو ةكرتشصلا نص يطخ ضرع نيتشكوه 2 كؤألا موبسألا ملاعلا اراطشنا",
  "tokens": [
    {
      "text": "ردل 4 ةملا",
      "bbox": [
        1094.0,
        165.0,
        1182.0,
        192.0
      ],
      "confidence": 68.12
    },
    {
      "text": "ةحعص ",
      "bbox": [
        545.0,
        206.0,
        623.0,
        228.0
      ],
      "confidence": 81.41
    },
    {
      "text": "قيقحت",
      "bbox": [
        219.0,
        217.0,
        329.0,
        255.0
      ],
      "confidence": 85.57
    },
    {
      "text": "رابخألا",
      "bbox": [
        540.0,
        212.0,
        1199.0,
        450.0
      ],
      "confidence": 91.48
    },
    {
      "text": "ميلضا تاباحلا",
      "bbox": [
        210.0,
        283.0,
        331.0,
        313.0
      ],
      "confidence": 82.62
    },
    {
      "text": "بورخلا",
      "bbox": [
        263.0,
        310.0,
        334.0,
        340.0
      ],
      "confidence": 99.17
    },
    {
      "text": "ام هز",
      "bbox": [
        357.0,
        329.0,
        483.0,
        373.0
      ],
      "confidence": 72.51
    },
    {
      "text": "ةعامجلا",
      "bbox": [
        230.0,
        335.0,
        332.0,
        364.0
      ],
      "confidence": 91.29
    },
    {
      "text": "طالبنجو",
      "bbox": [
        177.0,
        366.0,
        263.0,
        390.0
      ],
      "confidence": 91.9
    },
    {
      "text": "تمسح",
      "bbox": [
        259.0,
        366.0,
        331.0,
        388.0
      ],
      "confidence": 82.42
    },
    {
      "text": "راوللا و كبرم",
      "bbox": [
        197.0,
        386.0,
        335.0,
        420.0
      ],
      "confidence": 81.62
    },
    {
      "text": "نولئافتم",
      "bbox": [
        237.0,
        414.0,
        334.0,
        441.0
      ],
      "confidence": 97.39
    },
    {
      "text": "ةيباختنا",
      "bbox": [
        848.0,
        506.0,
        954.0,
        543.0
      ],
      "confidence": 90.63
    },
    {
      "text": "ةيوست",
      "bbox": [
        953.0,
        503.0,
        1046.0,
        543.0
      ],
      "confidence": 98.77
    },
    {
      "text": "ةحيضفب",
      "bbox": [
        269.0,
        526.0,
        418.0,
        557.0
      ],
      "confidence": 82.01
    },
    {
      "text": "دّدهي",
      "bbox": [
        497.0,
        521.0,
        572.0,
        553.0
      ],
      "confidence": 78.41
    },
    {
      "text": "ريفشو",
      "bbox": [
        572.0,
        517.0,
        660.0,
        553.0
      ],
      "confidence": 91.26
    },
    {
      "text": "روجألا",
      "bbox": [
        676.0,
        515.0,
        760.0,
        554.0
      ],
      "confidence": 91.02
    },
    {
      "text": "عيقرتل",
      "bbox": [
        762.0,
        513.0,
        850.0,
        547.0
      ],
      "confidence": 89.15
    },
    {
      "text": "رمسألا",
      "bbox": [
        418.0,
        522.0,
        499.0,
        558.0
      ],
      "confidence": 89.0
    },
    {
      "text": " ",
      "bbox": [
        671.0,
        532.0,
        679.0,
        544.0
      ],
      "confidence": 55.13
    },
    {
      "text": "ةرادإل",
      "bbox": [
        591.0,
        592.0,
        696.0,
        646.0
      ],
      "confidence": 98.38
    },
    {
      "text": "ليئارسإلل",
      "bbox": [
        846.0,
        582.0,
        1001.0,
        640.0
      ],
      "confidence": 93.52
    },
    {
      "text": " ",
      "bbox": [
        1008.0,
        590.0,
        1039.0,
        625.0
      ],
      "confidence": 51.09
    },
    {
      "text": "كولبلا",
      "bbox": [
        1032.0,
        576.0,
        1166.0,
        638.0
      ],
      "confidence": 92.6
    },
    {
      "text": "لوقحلا",
      "bbox": [
        440.0,
        597.0,
        591.0,
        647.0
      ],
      "confidence": 90.71
    },
    {
      "text": "رطقو",
      "bbox": [
        699.0,
        593.0,
        819.0,
        642.0
      ],
      "confidence": 88.84
    },
    {
      "text": "ةكرتشصلا",
      "bbox": [
        263.0,
        604.0,
        441.0,
        646.0
      ],
      "confidence": 98.68
    },
    {
      "text": "نص",
      "bbox": [
        630.0,
        659.0,
        751.0,
        731.0
      ],
      "confidence": 93.06
    },
    {
      "text": "يطخ",
      "bbox": [
        758.0,
        654.0,
        966.0,
        738.0
      ],
      "confidence": 99.21
    },
    {
      "text": "ضرع",
      "bbox": [
        975.0,
        648.0,
        1169.0,
        739.0
      ],
      "confidence": 99.97
    },
    {
      "text": "نيتشكوه",
      "bbox": [
        258.0,
        667.0,
        619.0,
        741.0
      ],
      "confidence": 97.31
    },
    {
      "text": "2",
      "bbox": [
        159.0,
        701.0,
        216.0,
        740.0
      ],
      "confidence": 93.64
    },
    {
      "text": "كؤألا",
      "bbox": [
        384.0,
        834.0,
        505.0,
        893.0
      ],
      "confidence": 72.01
    },
    {
      "text": "موبسألا",
      "bbox": [
        485.0,
        828.0,
        655.0,
        896.0
      ],
      "confidence": 90.46
    },
    {
      "text": "ملاعلا",
      "bbox": [
        225.0,
        912.0,
        426.0,
        976.0
      ],
      "confidence": 99.17
    },
    {
      "text": "اراطشنا",
      "bbox": [
        404.0,
        909.0,
        659.0,
        968.0
      ],
      "confidence": 81.16
    }
  ],
  "processing_time_ms": 295
}