{
  "document_id": "Comics/00370",
  "engine": "paddleocr",
  "raw_text": "يدحو يلل يل اهنإ , ب",
  "tokens": [
    {
      "text": "يدحو يلل يل اهنإ",
      "bbox": [
        1322.0,
        1063.0,
        1598.0,
        1138.0
      ],
      "confidence": 85.88
    },
    {
      "text": ",",
      "bbox": [
        1909.0,
        3771.0,
        2339.0,
        4152.0
      ],
      "confidence": 52.1
    },
    {
      "text": "ب",
      "bbox": [
        2292.0,
        3767.0,
        2479.0,
        3902.0
      ],
      "confidence": 71.93
    }
  ],
  "processing_time_ms": 296
}