{
  "document_id": "Map/00552",
  "engine": "paddleocr",
  "raw_text": "سلبارط/ ةينضلا اترغز لمرهنلا نويم تدم نورتبلا يرشب ليبج ك ينوج توريب ةديدج تي نينب توريي ريثات قاطن بارط ريثان قاظ ايشا اديص ريثان قا دحر ريثان قان ةيظدفلا رئان قاتح نويعج لي ريشثات قاثح ةمصاجلا ريثاط زكرم ةظفاصما ريااد زرم صملا ريثان ركرب باطقتسالا زك ارم تالاجم دنتسم",
  "tokens": [
    {
      "text": "سلبارط/",
      "bbox": [
        204.0,
        124.0,
        275.0,
        151.0
      ],
      "confidence": 85.58
    },
    {
      "text": "ةينضلا",
      "bbox": [
        307.0,
        136.0,
        349.0,
        152.0
      ],
      "confidence": 95.27
    },
    {
      "text": "اترغز",
      "bbox": [
        253.0,
        144.0,
        292.0,
        168.0
      ],
      "confidence": 86.87
    },
    {
      "text": "لمرهنلا",
      "bbox": [
        385.0,
        154.0,
        418.0,
        168.0
      ],
      "confidence": 89.72
    },
    {
      "text": "نويم",
      "bbox": [
        221.0,
        179.0,
        265.0,
        194.0
      ],
      "confidence": 76.89
    },
    {
      "text": "تدم",
      "bbox": [
        293.0,
        177.0,
        329.0,
        199.0
      ],
      "confidence": 90.65
    },
    {
      "text": "نورتبلا",
      "bbox": [
        164.0,
        188.0,
        219.0,
        216.0
      ],
      "confidence": 99.77
    },
    {
      "text": "يرشب",
      "bbox": [
        299.0,
        204.0,
        337.0,
        224.0
      ],
      "confidence": 79.62
    },
    {
      "text": "ليبج",
      "bbox": [
        176.0,
        234.0,
        206.0,
        249.0
      ],
      "confidence": 91.9
    },
    {
      "text": "ك",
      "bbox": [
        333.0,
        266.0,
        346.0,
        275.0
      ],
      "confidence": 85.68
    },
    {
      "text": "ينوج",
      "bbox": [
        162.0,
        281.0,
        202.0,
        294.0
      ],
      "confidence": 92.11
    },
    {
      "text": "توريب",
      "bbox": [
        117.0,
        307.0,
        181.0,
        329.0
      ],
      "confidence": 85.68
    },
    {
      "text": "ةديدج",
      "bbox": [
        189.0,
        311.0,
        226.0,
        325.0
      ],
      "confidence": 83.4
    },
    {
      "text": "تي",
      "bbox": [
        197.0,
        378.0,
        215.0,
        386.0
      ],
      "confidence": 76.09
    },
    {
      "text": "نينب",
      "bbox": [
        235.0,
        394.0,
        263.0,
        410.0
      ],
      "confidence": 89.66
    },
    {
      "text": "توريي",
      "bbox": [
        346.0,
        397.0,
        372.0,
        408.0
      ],
      "confidence": 76.28
    },
    {
      "text": "ريثات قاطن",
      "bbox": [
        372.0,
        394.0,
        416.0,
        408.0
      ],
      "confidence": 89.6
    },
    {
      "text": "بارط",
      "bbox": [
        341.0,
        415.0,
        370.0,
        429.0
      ],
      "confidence": 66.29
    },
    {
      "text": "ريثان",
      "bbox": [
        374.0,
        415.0,
        395.0,
        426.0
      ],
      "confidence": 82.58
    },
    {
      "text": "قاظ",
      "bbox": [
        393.0,
        417.0,
        412.0,
        425.0
      ],
      "confidence": 85.78
    },
    {
      "text": "ايشا",
      "bbox": [
        264.0,
        435.0,
        290.0,
        446.0
      ],
      "confidence": 92.53
    },
    {
      "text": "اديص ريثان",
      "bbox": [
        350.0,
        437.0,
        394.0,
        448.0
      ],
      "confidence": 80.37
    },
    {
      "text": "قا",
      "bbox": [
        393.0,
        438.0,
        411.0,
        446.0
      ],
      "confidence": 78.85
    },
    {
      "text": "دحر",
      "bbox": [
        351.0,
        460.0,
        371.0,
        468.0
      ],
      "confidence": 67.16
    },
    {
      "text": "ريثان",
      "bbox": [
        368.0,
        458.0,
        395.0,
        469.0
      ],
      "confidence": 73.53
    },
    {
      "text": "قان",
      "bbox": [
        391.0,
        458.0,
        413.0,
        469.0
      ],
      "confidence": 71.47
    },
    {
      "text": "ةيظدفلا",
      "bbox": [
        341.0,
        479.0,
        372.0,
        489.0
      ],
      "confidence": 79.71
    },
    {
      "text": "رئان",
      "bbox": [
        369.0,
        478.0,
        394.0,
        489.0
      ],
      "confidence": 68.33
    },
    {
      "text": "قاتح",
      "bbox": [
        395.0,
        479.0,
        411.0,
        487.0
      ],
      "confidence": 69.94
    },
    {
      "text": "نويعج",
      "bbox": [
        199.0,
        491.0,
        230.0,
        501.0
      ],
      "confidence": 87.14
    },
    {
      "text": "لي",
      "bbox": [
        349.0,
        502.0,
        371.0,
        510.0
      ],
      "confidence": 81.47
    },
    {
      "text": "ريشثات",
      "bbox": [
        368.0,
        499.0,
        395.0,
        510.0
      ],
      "confidence": 73.94
    },
    {
      "text": "قاثح",
      "bbox": [
        394.0,
        500.0,
        411.0,
        508.0
      ],
      "confidence": 83.18
    },
    {
      "text": "ةمصاجلا",
      "bbox": [
        337.0,
        549.0,
        375.0,
        559.0
      ],
      "confidence": 76.73
    },
    {
      "text": "ريثاط زكرم",
      "bbox": [
        373.0,
        548.0,
        412.0,
        559.0
      ],
      "confidence": 79.31
    },
    {
      "text": "ةظفاصما",
      "bbox": [
        335.0,
        568.0,
        372.0,
        579.0
      ],
      "confidence": 70.67
    },
    {
      "text": "ريااد",
      "bbox": [
        374.0,
        567.0,
        395.0,
        579.0
      ],
      "confidence": 68.35
    },
    {
      "text": "زرم",
      "bbox": [
        391.0,
        567.0,
        413.0,
        578.0
      ],
      "confidence": 53.83
    },
    {
      "text": "صملا",
      "bbox": [
        345.0,
        586.0,
        375.0,
        599.0
      ],
      "confidence": 74.54
    },
    {
      "text": "ريثان",
      "bbox": [
        371.0,
        583.0,
        397.0,
        599.0
      ],
      "confidence": 80.11
    },
    {
      "text": "ركرب",
      "bbox": [
        393.0,
        588.0,
        411.0,
        596.0
      ],
      "confidence": 67.69
    },
    {
      "text": "باطقتسالا",
      "bbox": [
        180.0,
        638.0,
        238.0,
        656.0
      ],
      "confidence": 79.41
    },
    {
      "text": "زك ارم تالاجم",
      "bbox": [
        237.0,
        637.0,
        318.0,
        660.0
      ],
      "confidence": 86.96
    },
    {
      "text": " ",
      "bbox": [
        324.0,
        646.0,
        338.0,
        658.0
      ],
      "confidence": 56.05
    },
    {
      "text": "دنتسم",
      "bbox": [
        334.0,
        646.0,
        368.0,
        657.0
      ],
      "confidence": 76.07
    }
  ],
  "processing_time_ms": 273
}