{
  "document_id": "Book/00434",
  "engine": "paddleocr",
  "raw_text": "لئاسر نم نآرقلا يواقرش مددأ ةدعاسس نب سق Akalemat",
  "tokens": [
    {
      "text": "لئاسر",
      "bbox": [
        575.0,
        481.0,
        1144.0,
        726.0
      ],
      "confidence": 91.67
    },
    {
      "text": "نم",
      "bbox": [
        574.0,
        711.0,
        1122.0,
        950.0
      ],
      "confidence": 92.28
    },
    {
      "text": "نآرقلا",
      "bbox": [
        565.0,
        916.0,
        1104.0,
        1163.0
      ],
      "confidence": 96.43
    },
    {
      "text": "يواقرش مددأ",
      "bbox": [
        717.0,
        1188.0,
        981.0,
        1262.0
      ],
      "confidence": 91.15
    },
    {
      "text": "ةدعاسس نب سق",
      "bbox": [
        752.0,
        1254.0,
        931.0,
        1296.0
      ],
      "confidence": 87.49
    },
    {
      "text": "Akalemat",
      "bbox": [
        743.0,
        1412.0,
        923.0,
        1468.0
      ],
      "confidence": 92.63
    }
  ],
  "processing_time_ms": 218
}