{
  "document_id": "Map/00174",
  "engine": "paddleocr",
  "raw_text": "يبورودلا داحتالا يف ةددجتملا ةقاطلا",
  "tokens": [
    {
      "text": "يبورودلا",
      "bbox": [
        873.0,
        552.0,
        1109.0,
        642.0
      ],
      "confidence": 86.71
    },
    {
      "text": "داحتالا",
      "bbox": [
        1103.0,
        566.0,
        1302.0,
        641.0
      ],
      "confidence": 96.37
    },
    {
      "text": "يف",
      "bbox": [
        1306.0,
        575.0,
        1399.0,
        645.0
      ],
      "confidence": 96.63
    },
    {
      "text": "ةددجتملا",
      "bbox": [
        1407.0,
        570.0,
        1679.0,
        650.0
      ],
      "confidence": 97.97
    },
    {
      "text": "ةقاطلا",
      "bbox": [
        1669.0,
        574.0,
        1891.0,
        642.0
      ],
      "confidence": 96.42
    },
    {
      "text": " ",
      "bbox": [
        2414.0,
        1806.0,
        2435.0,
        1835.0
      ],
      "confidence": 60.24
    }
  ],
  "processing_time_ms": 380
}