{
  "document_id": "Label/00508",
  "engine": "paddleocr",
  "raw_text": "01002-110 110- ةلحز ةيذحا",
  "tokens": [
    {
      "text": "01002-110",
      "bbox": [
        249.0,
        482.0,
        384.0,
        505.0
      ],
      "confidence": 75.38
    },
    {
      "text": "110-",
      "bbox": [
        236.0,
        516.0,
        277.0,
        538.0
      ],
      "confidence": 92.37
    },
    {
      "text": "ةلحز ةيذحا",
      "bbox": [
        280.0,
        513.0,
        374.0,
        540.0
      ],
      "confidence": 90.99
    }
  ],
  "processing_time_ms": 58
}