{
  "document_id": "Comics/005",
  "engine": "paddleocr",
  "raw_text": "اشرتف ٥١ ١٨٩١ سرام ٣١ يمسقبك ٧٧٧ نس نم عيمجلل تانبلل بابشلل :ةيدهلا ةشارفلا ديص ١ ل لا",
  "tokens": [
    {
      "text": "اشرتف ٥١",
      "bbox": [
        148.0,
        58.0,
        310.0,
        98.0
      ],
      "confidence": 74.47
    },
    {
      "text": "١٨٩١ سرام",
      "bbox": [
        337.0,
        65.0,
        527.0,
        107.0
      ],
      "confidence": 86.65
    },
    {
      "text": "٣١",
      "bbox": [
        569.0,
        80.0,
        615.0,
        102.0
      ],
      "confidence": 99.41
    },
    {
      "text": "يمسقبك",
      "bbox": [
        132.0,
        116.0,
        767.0,
        286.0
      ],
      "confidence": 83.55
    },
    {
      "text": "٧٧٧",
      "bbox": [
        138.0,
        270.0,
        295.0,
        308.0
      ],
      "confidence": 83.09
    },
    {
      "text": "نس نم",
      "bbox": [
        294.0,
        276.0,
        408.0,
        312.0
      ],
      "confidence": 98.93
    },
    {
      "text": "عيمجلل",
      "bbox": [
        471.0,
        280.0,
        612.0,
        317.0
      ],
      "confidence": 90.69
    },
    {
      "text": "تانبلل",
      "bbox": [
        675.0,
        279.0,
        798.0,
        315.0
      ],
      "confidence": 95.99
    },
    {
      "text": "  ",
      "bbox": [
        423.0,
        291.0,
        442.0,
        304.0
      ],
      "confidence": 58.69
    },
    {
      "text": "بابشلل",
      "bbox": [
        854.0,
        278.0,
        992.0,
        319.0
      ],
      "confidence": 96.8
    },
    {
      "text": ":ةيدهلا",
      "bbox": [
        843.0,
        355.0,
        958.0,
        392.0
      ],
      "confidence": 86.97
    },
    {
      "text": "ةشارفلا ديص",
      "bbox": [
        783.0,
        388.0,
        970.0,
        457.0
      ],
      "confidence": 90.29
    },
    {
      "text": "١",
      "bbox": [
        506.0,
        1356.0,
        557.0,
        1378.0
      ],
      "confidence": 69.68
    },
    {
      "text": "ل",
      "bbox": [
        568.0,
        1358.0,
        604.0,
        1383.0
      ],
      "confidence": 51.38
    },
    {
      "text": "لا",
      "bbox": [
        780.0,
        1354.0,
        899.0,
        1410.0
      ],
      "confidence": 82.63
    }
  ],
  "processing_time_ms": 157
}