{
  "document_id": "Business card/00432",
  "engine": "paddleocr",
  "raw_text": "ةسلسؤم زيزعلا ةيراجتلا ةفاك عيب تاودلا ةيئابرهكلا ةيحصلا قيرط دعب . شيكيردلا ةيزاك دعس خيشلا ىلع م 200 نيميلا",
  "tokens": [
    {
      "text": "ةسلسؤم",
      "bbox": [
        366.0,
        59.0,
        502.0,
        119.0
      ],
      "confidence": 86.66
    },
    {
      "text": "زيزعلا",
      "bbox": [
        273.0,
        88.0,
        364.0,
        151.0
      ],
      "confidence": 97.18
    },
    {
      "text": "ةيراجتلا",
      "bbox": [
        154.0,
        111.0,
        275.0,
        180.0
      ],
      "confidence": 89.98
    },
    {
      "text": "ةفاك",
      "bbox": [
        379.0,
        155.0,
        426.0,
        186.0
      ],
      "confidence": 93.91
    },
    {
      "text": "عيب",
      "bbox": [
        429.0,
        154.0,
        458.0,
        181.0
      ],
      "confidence": 95.39
    },
    {
      "text": "تاودلا",
      "bbox": [
        314.0,
        160.0,
        387.0,
        209.0
      ],
      "confidence": 92.12
    },
    {
      "text": "ةيئابرهكلا",
      "bbox": [
        215.0,
        180.0,
        320.0,
        234.0
      ],
      "confidence": 92.31
    },
    {
      "text": "ةيحصلا",
      "bbox": [
        140.0,
        208.0,
        213.0,
        252.0
      ],
      "confidence": 98.75
    },
    {
      "text": " ",
      "bbox": [
        218.0,
        218.0,
        227.0,
        226.0
      ],
      "confidence": 70.93
    },
    {
      "text": "قيرط",
      "bbox": [
        490.0,
        278.0,
        536.0,
        309.0
      ],
      "confidence": 99.9
    },
    {
      "text": "دعب . شيكيردلا",
      "bbox": [
        383.0,
        287.0,
        493.0,
        336.0
      ],
      "confidence": 87.16
    },
    {
      "text": "ةيزاك",
      "bbox": [
        331.0,
        316.0,
        384.0,
        346.0
      ],
      "confidence": 91.78
    },
    {
      "text": "دعس خيشلا",
      "bbox": [
        251.0,
        324.0,
        342.0,
        372.0
      ],
      "confidence": 94.82
    },
    {
      "text": "ىلع م",
      "bbox": [
        177.0,
        353.0,
        231.0,
        386.0
      ],
      "confidence": 92.41
    },
    {
      "text": "200",
      "bbox": [
        215.0,
        345.0,
        255.0,
        374.0
      ],
      "confidence": 78.04
    },
    {
      "text": "نيميلا",
      "bbox": [
        131.0,
        365.0,
        183.0,
        398.0
      ],
      "confidence": 96.57
    }
  ],
  "processing_time_ms": 111
}