{
  "document_id": "Administrative form/00751",
  "engine": "paddleocr",
  "raw_text": "ةراو   ةاقط بطط ///// ةيحلا فسلا رق لمعلا زايرم ةينسلا ة ةصش ةبرت ف ةسؤف عفوه ديحولا فرعملا مقر لمحت ةروصلا ةيفلخ :ةظحالم ةيطولا فيرعتلا تافاطب ةسصاختلا ةروضلا تافساوم لمحتو اهبلع ةقصال ربغ ةبسش اةررضب ةفاطلا ءاذه بحصت",
  "tokens": [
    {
      "text": "ةراو",
      "bbox": [
        351.0,
        7.0,
        385.0,
        23.0
      ],
      "confidence": 63.94
    },
    {
      "text": "  ةاقط",
      "bbox": [
        169.0,
        30.0,
        198.0,
        41.0
      ],
      "confidence": 70.68
    },
    {
      "text": "بطط",
      "bbox": [
        318.0,
        22.0,
        337.0,
        29.0
      ],
      "confidence": 55.86
    },
    {
      "text": "/////",
      "bbox": [
        262.0,
        117.0,
        420.0,
        147.0
      ],
      "confidence": 75.94
    },
    {
      "text": "ةيحلا فسلا رق",
      "bbox": [
        356.0,
        142.0,
        407.0,
        157.0
      ],
      "confidence": 60.44
    },
    {
      "text": "لمعلا زايرم",
      "bbox": [
        386.0,
        217.0,
        418.0,
        227.0
      ],
      "confidence": 73.94
    },
    {
      "text": "ةينسلا ة",
      "bbox": [
        380.0,
        243.0,
        420.0,
        255.0
      ],
      "confidence": 82.58
    },
    {
      "text": "ةصش ةبرت ف ةسؤف عفوه",
      "bbox": [
        322.0,
        460.0,
        444.0,
        476.0
      ],
      "confidence": 60.88
    },
    {
      "text": "ديحولا",
      "bbox": [
        184.0,
        505.0,
        217.0,
        520.0
      ],
      "confidence": 96.09
    },
    {
      "text": "فرعملا",
      "bbox": [
        220.0,
        505.0,
        259.0,
        520.0
      ],
      "confidence": 92.74
    },
    {
      "text": "مقر لمحت",
      "bbox": [
        259.0,
        504.0,
        312.0,
        521.0
      ],
      "confidence": 99.05
    },
    {
      "text": "ةروصلا",
      "bbox": [
        306.0,
        503.0,
        352.0,
        524.0
      ],
      "confidence": 94.57
    },
    {
      "text": "ةيفلخ",
      "bbox": [
        353.0,
        505.0,
        383.0,
        521.0
      ],
      "confidence": 99.18
    },
    {
      "text": ":ةظحالم",
      "bbox": [
        386.0,
        506.0,
        429.0,
        521.0
      ],
      "confidence": 95.52
    },
    {
      "text": "ةيطولا",
      "bbox": [
        1.0,
        530.0,
        29.0,
        543.0
      ],
      "confidence": 79.09
    },
    {
      "text": "فيرعتلا",
      "bbox": [
        27.0,
        532.0,
        56.0,
        543.0
      ],
      "confidence": 90.52
    },
    {
      "text": "تافاطب ةسصاختلا",
      "bbox": [
        57.0,
        530.0,
        119.0,
        547.0
      ],
      "confidence": 85.3
    },
    {
      "text": "ةروضلا",
      "bbox": [
        117.0,
        535.0,
        146.0,
        546.0
      ],
      "confidence": 93.15
    },
    {
      "text": "تافساوم لمحتو اهبلع",
      "bbox": [
        147.0,
        533.0,
        235.0,
        551.0
      ],
      "confidence": 87.87
    },
    {
      "text": "ةقصال ربغ",
      "bbox": [
        236.0,
        534.0,
        283.0,
        551.0
      ],
      "confidence": 84.8
    },
    {
      "text": "ةبسش اةررضب",
      "bbox": [
        279.0,
        535.0,
        341.0,
        552.0
      ],
      "confidence": 67.43
    },
    {
      "text": "ةفاطلا ءاذه بحصت",
      "bbox": [
        340.0,
        536.0,
        415.0,
        552.0
      ],
      "confidence": 90.25
    }
  ],
  "processing_time_ms": 170
}